{
  "$schema": "../../../../schema/horn.schema.json",
  "brand": "Beyma",
  "model": "TD/365",
  "exitInch": 1.4,
  "coverageHorizontalDeg": 60,
  "coverageVerticalDeg": 50,
  "cutoffHz": 1000,
  "mouthWmm": 204,
  "mouthHmm": 202,
  "depthMm": 121,
  "profile": "conical",
  "material": "aluminium",
  "weightKg": 1.2,
  "datasheetUrl": "https://www.beyma.com/en/products/c/horns/1TD365/bocina-td-365/"
}
