{
  "$schema": "../../../../schema/horn.schema.json",
  "brand": "RCF",
  "model": "HF66",
  "exitInch": 1.4,
  "coverageHorizontalDeg": 90,
  "coverageVerticalDeg": 40,
  "cutoffHz": 500,
  "mouthWmm": 205,
  "mouthHmm": 205,
  "depthMm": 135,
  "profile": "oblate_spheroid",
  "material": "aluminum",
  "weightKg": 1.35,
  "datasheetUrl": "https://www.rcf.it/en/products/product-detail/hf66"
}
